{
  "contract": "1.0",
  "meta": {
    "id": "recipe-particles",
    "name": "Recipe: Closed-Form Particles",
    "description": "A beat-triggered spark burst built as closed-form trajectories of (index, age) per contract section 6.1 — no per-particle simulation. rand(i + beat_count * 1000) re-rolls each spark's direction and speed on every beat; a launch-time var (lastBeatT) records when the current burst started; position is a pure function of the spark's random direction and its age (t - lastBeatT). Sparks fade out as they fly, and the whole burst only appears when a beat fires, so silence stays calm.",
    "author": "ViewMusic authoring manual"
  },
  "settings": {
    "particles": { "type": "number", "label": "Particles", "min": 16, "max": 400, "step": 1, "default": 140 },
    "spread": { "type": "number", "label": "Spread", "min": 0.3, "max": 2, "step": 0.05, "default": 1.1 },
    "life": { "type": "number", "label": "Life (s)", "min": 0.4, "max": 3, "step": 0.1, "default": 1.4 },
    "sparkColor": { "type": "color", "label": "Spark color", "default": "#ffaa33" }
  },
  "vars": {
    "lastBeatT": { "init": "0", "frame": "if(beat >= 1, t, lastBeatT)" }
  },
  "scene": [
    {
      "type": "instanced",
      "shape": "circle",
      "blend": "add",
      "count": "settings.particles",
      "element": {
        "x": "cos(rand(i + beat_count * 1000) * tau) * settings.spread * (0.4 + 0.6 * rand(i + 100 + beat_count * 1000)) * clamp((t - lastBeatT) / settings.life, 0, 1) / aspect",
        "y": "sin(rand(i + beat_count * 1000) * tau) * settings.spread * (0.4 + 0.6 * rand(i + 100 + beat_count * 1000)) * clamp((t - lastBeatT) / settings.life, 0, 1)",
        "w": "(0.008 + 0.018 * rand(i + 200 + beat_count * 1000)) / aspect",
        "h": "0.008 + 0.018 * rand(i + 200 + beat_count * 1000)",
        "rot": "0",
        "color": {
          "model": "rgba",
          "r": "settings.sparkColor_r * (1 - clamp((t - lastBeatT) / settings.life, 0, 1))",
          "g": "settings.sparkColor_g * (1 - clamp((t - lastBeatT) / settings.life, 0, 1))",
          "b": "settings.sparkColor_b * (1 - clamp((t - lastBeatT) / settings.life, 0, 1))",
          "a": "(1 - clamp((t - lastBeatT) / settings.life, 0, 1)) * step(0, settings.life - (t - lastBeatT))"
        }
      }
    }
  ],
  "feedback": { "decay": "0.88" }
}
