{
  "contract": "1.0",
  "meta": { "id": "setting-beat", "name": "Setting Named Beat" },
  "settings": {
    "beat": { "type": "number", "label": "Beat", "min": 0, "max": 1, "default": 0 }
  },
  "scene": [
    { "type": "field", "resolution": 4,
      "cell": { "color": { "model": "rgba", "r": 1, "g": 0, "b": 0 } } }
  ]
}
