{
  "contract": "1.0",
  "meta": {
    "id": "pixel-rain",
    "name": "Pixel Rain",
    "description": "Digital rain: columns of glyph-like rects streaming downward. Each column has a stable random speed and offset; within a column the cells form a fading trail behind a bright falling head. Per-column speed and brightness scale with the spectrum band at that column's x, so loud frequencies pour faster and brighter — but luminance follows the band smoothly, never the beat. Green-on-black by default; tune the hue, column count, fall speed, and trail length. Silence slows the rain to a gentle drip and dims it.",
    "author": "ViewMusic built-in"
  },
  "settings": {
    "columns": { "type": "number", "label": "Columns", "min": 8, "max": 64, "step": 1, "default": 32 },
    "fallSpeed": { "type": "number", "label": "Fall speed", "min": 0.1, "max": 2, "step": 0.05, "default": 0.6 },
    "hue": { "type": "number", "label": "Hue", "min": 0, "max": 360, "step": 1, "default": 130 },
    "trail": { "type": "number", "label": "Trail length", "min": 2, "max": 16, "step": 0.5, "default": 9 },
    "headColor": { "type": "color", "label": "Head glow", "default": "#ccffcc" }
  },
  "vars": {
    "energy_s": { "init": "0", "frame": "energy_s * 0.88 + energy * 0.12" }
  },
  "feedback": { "decay": "0.55" },
  "scene": [
    {
      "type": "instanced",
      "shape": "rect",
      "blend": "add",
      "count": "floor(settings.columns) * 18",
      "element": {
        "x": "-1 + (2 * floor(i / 18) + 1) / floor(settings.columns)",
        "y": "1 - 2 * fract((i % 18) / 18 + fract(t * settings.fallSpeed * (0.35 + 0.6 * rand(floor(i / 18))) * (0.4 + 0.9 * band(floor(i / 18) / max(floor(settings.columns) - 1, 1))) + rand(floor(i / 18) + 7)))",
        "w": "1.3 / floor(settings.columns) / aspect",
        "h": "1.0 / 18",
        "color": {
          "model": "hsva",
          "h": "settings.hue + 20 * fract((i % 18) / 18 + fract(t * settings.fallSpeed * (0.35 + 0.6 * rand(floor(i / 18))) + rand(floor(i / 18) + 7)))",
          "s": "0.85",
          "v": "(0.06 + 0.55 * band(floor(i / 18) / max(floor(settings.columns) - 1, 1))) * (0.3 + 0.7 * smoothstep(0.02, 0.12, energy_s)) * pow(1 - fract((i % 18) / 18 + fract(t * settings.fallSpeed * (0.35 + 0.6 * rand(floor(i / 18))) * (0.4 + 0.9 * band(floor(i / 18) / max(floor(settings.columns) - 1, 1))) + rand(floor(i / 18) + 7))), 18 / settings.trail)",
          "a": "0.9"
        }
      }
    },
    {
      "type": "instanced",
      "shape": "rect",
      "blend": "add",
      "count": "floor(settings.columns)",
      "element": {
        "x": "-1 + (2 * i + 1) / floor(settings.columns)",
        "y": "1 - 2 * fract(fract(t * settings.fallSpeed * (0.35 + 0.6 * rand(i)) * (0.4 + 0.9 * band(i / max(floor(settings.columns) - 1, 1))) + rand(i + 7)))",
        "w": "1.5 / floor(settings.columns) / aspect",
        "h": "1.0 / 18 * 1.2",
        "color": {
          "model": "rgba",
          "r": "settings.headColor_r * ((0.3 + 0.7 * band(i / max(floor(settings.columns) - 1, 1))) * (0.4 + 0.6 * smoothstep(0.02, 0.12, energy_s)) + 0.05)",
          "g": "settings.headColor_g * ((0.3 + 0.7 * band(i / max(floor(settings.columns) - 1, 1))) * (0.4 + 0.6 * smoothstep(0.02, 0.12, energy_s)) + 0.05)",
          "b": "settings.headColor_b * ((0.3 + 0.7 * band(i / max(floor(settings.columns) - 1, 1))) * (0.4 + 0.6 * smoothstep(0.02, 0.12, energy_s)) + 0.05)",
          "a": "0.95"
        }
      }
    }
  ]
}
