{
  "contract": "1.0",
  "meta": {
    "id": "my-pulse",
    "name": "My Pulse",
    "description": "Tutorial step 5 — polished: hue from the spectrum, gentle energy-gated idle motion, and a second accent layer.",
    "author": "ViewMusic authoring manual"
  },
  "settings": {
    "tint": {
      "type": "color",
      "label": "Accent color",
      "default": "#ffcc44"
    }
  },
  "vars": {
    "pulse": { "init": "0", "frame": "max(pulse * 0.9, energy)" },
    "drift": { "init": "0", "frame": "drift + dt * (0.2 + 1.5 * energy)" }
  },
  "scene": [
    {
      "type": "instanced",
      "shape": "circle",
      "blend": "add",
      "count": 1,
      "element": {
        "x": "0.06 * cos(drift) / aspect",
        "y": "0.06 * sin(drift)",
        "w": "(0.2 + 0.6 * pulse) / aspect",
        "h": "0.2 + 0.6 * pulse",
        "color": {
          "model": "hsva",
          "h": "200 + 120 * band(0.2)",
          "s": "0.75",
          "v": "0.25 + 0.6 * smoothstep(0.02, 0.2, pulse)",
          "a": "1"
        }
      }
    },
    {
      "type": "instanced",
      "shape": "circle",
      "blend": "add",
      "count": 1,
      "element": {
        "x": "0",
        "y": "0",
        "w": "(0.05 + 0.12 * pulse) / aspect",
        "h": "0.05 + 0.12 * pulse",
        "color": {
          "model": "rgba",
          "r": "settings.tint_r * (0.2 + 0.8 * pulse)",
          "g": "settings.tint_g * (0.2 + 0.8 * pulse)",
          "b": "settings.tint_b * (0.2 + 0.8 * pulse)",
          "a": "0.9"
        }
      }
    }
  ]
}
