{
  "contract": "1.0",
  "meta": { "id": "min-gt-max", "name": "Min Greater Than Max" },
  "settings": {
    "size": { "type": "number", "label": "Size", "min": 10, "max": 1, "default": 5 }
  },
  "scene": [
    { "type": "field", "resolution": 4,
      "cell": { "color": { "model": "rgba", "r": 1, "g": 0, "b": 0 } } }
  ]
}
