{
  "contract": "1.0",
  "meta": {
    "id": "kaleido-petals",
    "name": "Kaleido Petals",
    "description": "A kaleidoscopic flower: N triangle petals arranged in a ring, each rotated to point outward by u*tau plus an accumulating spin var. Petal length breathes with its own spectrum band, and a smoothed beat adds a tiny bloom to the petal length only (never a flash). A second, smaller inner ring counter-rotates for depth. Hue follows the petal angle plus a slow drift; additive blend makes the overlaps glow. Silence stills the spin and folds the petals to a calm small bud.",
    "author": "ViewMusic built-in"
  },
  "settings": {
    "petals": { "type": "number", "label": "Petal count", "min": 5, "max": 48, "step": 1, "default": 18 },
    "bloom": { "type": "number", "label": "Bloom intensity", "min": 0, "max": 0.4, "step": 0.01, "default": 0.18 },
    "hueRange": { "type": "number", "label": "Hue range", "min": 0, "max": 720, "step": 1, "default": 360 },
    "spinSpeed": { "type": "number", "label": "Spin speed", "min": 0, "max": 3, "step": 0.05, "default": 1 },
    "tint": { "type": "color", "label": "Base tint", "default": "#ff66cc" }
  },
  "vars": {
    "spin": { "init": "0", "frame": "spin + dt * settings.spinSpeed * (0.1 + 1.1 * energy)" },
    "bloomS": { "init": "0", "frame": "max(bloomS * 0.9, beat * 0.5)" },
    "drift": { "init": "0", "frame": "drift + dt * (0.04 + 0.3 * energy)" }
  },
  "scene": [
    {
      "type": "instanced",
      "shape": "triangle",
      "blend": "add",
      "count": "settings.petals",
      "element": {
        "x": "(0.18 + 0.32 * (0.3 + 0.7 * band(u)) * smoothstep(0.02, 0.12, energy) + settings.bloom * bloomS) * cos(u * tau + spin) / aspect",
        "y": "(0.18 + 0.32 * (0.3 + 0.7 * band(u)) * smoothstep(0.02, 0.12, energy) + settings.bloom * bloomS) * sin(u * tau + spin)",
        "w": "(0.07 + 0.05 * band(u)) / aspect",
        "h": "0.22 + 0.45 * (0.3 + 0.7 * band(u)) * smoothstep(0.02, 0.12, energy) + settings.bloom * bloomS",
        "rot": "u * tau + spin + pi / 2",
        "color": {
          "model": "hsva",
          "h": "u * settings.hueRange + drift * 30 + settings.tint_r * 120 + settings.tint_g * 240 + settings.tint_b * 360",
          "s": "0.85",
          "v": "0.18 + 0.62 * smoothstep(0.02, 0.12, energy) * (0.35 + 0.65 * band(u))",
          "a": "0.8"
        }
      }
    },
    {
      "type": "instanced",
      "shape": "triangle",
      "blend": "add",
      "count": "settings.petals",
      "element": {
        "x": "(0.07 + 0.16 * (0.3 + 0.7 * band(0.3 + 0.5 * u)) * smoothstep(0.02, 0.12, energy)) * cos(u * tau - spin * 1.3) / aspect",
        "y": "(0.07 + 0.16 * (0.3 + 0.7 * band(0.3 + 0.5 * u)) * smoothstep(0.02, 0.12, energy)) * sin(u * tau - spin * 1.3)",
        "w": "(0.045 + 0.03 * band(0.3 + 0.5 * u)) / aspect",
        "h": "0.12 + 0.22 * (0.3 + 0.7 * band(0.3 + 0.5 * u)) * smoothstep(0.02, 0.12, energy)",
        "rot": "u * tau - spin * 1.3 + pi / 2",
        "color": {
          "model": "hsva",
          "h": "u * settings.hueRange + drift * 30 + 180 + settings.tint_r * 120 + settings.tint_g * 240 + settings.tint_b * 360",
          "s": "0.7",
          "v": "0.2 + 0.6 * smoothstep(0.02, 0.12, energy) * (0.4 + 0.6 * band(0.3 + 0.5 * u))",
          "a": "0.75"
        }
      }
    }
  ],
  "feedback": { "decay": "0.8 + 0.1 * energy" }
}
